{
  "id": "P-002",
  "kind": "patent",
  "target": "TGT-9008",
  "title": "Online layer image quality inspection device for printing",
  "authors_or_applicants": [
    "Zengcai Visual Technology Co."
  ],
  "year": 2020,
  "source_db": "Espacenet",
  "url_or_doc_number": "ZZ900081A1",
  "summary_zh": "",
  "relevance": 3,
  "novelty_check": "untouched",
  "role": "pool",
  "evidence_level": "verified",
  "evidence_ref": "../02_search_logs/raw/N2_page-1.csv",
  "evidence_sha256": null,
  "tags": [
    "N2@TGT-9008"
  ],
  "logged_at": "2026-02-02T08:00:00+00:00",
  "source_log": "../02_search_logs/espacenet_2026-02-02_N2_1.log.json",
  "family": [],
  "cited_by": [],
  "pdf_path": null,
  "bibtex_key": "zz900081a12020"
}
