{
  "id": "P-004",
  "kind": "patent",
  "target": "TGT-9003",
  "title": "UAV swarm cooperative avoidance method",
  "authors_or_applicants": [
    "Lingyun Aircraft Laboratory"
  ],
  "year": 2022,
  "source_db": "Espacenet",
  "url_or_doc_number": "ZZ900035A1",
  "summary_zh": "",
  "relevance": 3,
  "novelty_check": "untouched",
  "role": "pool",
  "evidence_level": "verified",
  "evidence_ref": "../02_search_logs/raw/N2-2_page-1.csv",
  "evidence_sha256": null,
  "tags": [
    "N2@TGT-9003"
  ],
  "logged_at": "2026-02-04T08:00:00+00:00",
  "source_log": "../02_search_logs/espacenet_2026-02-04_N2-2_1.log.json",
  "family": [],
  "cited_by": [],
  "pdf_path": null,
  "bibtex_key": "zz900035a12022"
}
