{
  "id": "P-003",
  "kind": "patent",
  "target": "TGT-9005",
  "title": "Online water hammer protection system for water pipelines",
  "authors_or_applicants": [
    "Anliu Hydraulic Engineering Research Institute"
  ],
  "year": 2020,
  "source_db": "Espacenet",
  "url_or_doc_number": "ZZ900052A1",
  "summary_zh": "",
  "relevance": 3,
  "novelty_check": "untouched",
  "role": "pool",
  "evidence_level": "verified",
  "evidence_ref": "../02_search_logs/raw/N3_page-1.csv",
  "evidence_sha256": null,
  "tags": [
    "N3@TGT-9005"
  ],
  "logged_at": "2026-02-03T08:00:00+00:00",
  "source_log": "../02_search_logs/espacenet_2026-02-03_N3_1.log.json",
  "family": [],
  "cited_by": [],
  "pdf_path": null,
  "bibtex_key": "zz900052a12020"
}
