{
  "id": "P-002",
  "kind": "patent",
  "target": "TGT-9003",
  "title": "AGV central scheduling system",
  "authors_or_applicants": [
    "Cangji Logistics Equipment Co."
  ],
  "year": 2019,
  "source_db": "Espacenet",
  "url_or_doc_number": "ZZ900032A1",
  "summary_zh": "",
  "relevance": 3,
  "novelty_check": "untouched",
  "role": "pool",
  "evidence_level": "verified",
  "evidence_ref": "../02_search_logs/raw/N1-2_page-1.csv",
  "evidence_sha256": null,
  "tags": [
    "N1@TGT-9003"
  ],
  "logged_at": "2026-02-02T08:00:00+00:00",
  "source_log": "../02_search_logs/espacenet_2026-02-02_N1-2_1.log.json",
  "family": [],
  "cited_by": [],
  "pdf_path": null,
  "bibtex_key": "zz900032a12019"
}
