{
  "id": "P-005",
  "kind": "patent",
  "target": "TGT-9003",
  "title": "Robot swarm task reassignment method",
  "authors_or_applicants": [
    "Qunli Intelligent Equipment Research Institute"
  ],
  "year": 2021,
  "source_db": "Espacenet",
  "url_or_doc_number": "ZZ900034A1",
  "summary_zh": "",
  "relevance": 3,
  "novelty_check": "untouched",
  "role": "pool",
  "evidence_level": "verified",
  "evidence_ref": "../02_search_logs/raw/N4_page-1.csv",
  "evidence_sha256": null,
  "tags": [
    "N4@TGT-9003"
  ],
  "logged_at": "2026-02-05T08:00:00+00:00",
  "source_log": "../02_search_logs/espacenet_2026-02-05_N4_1.log.json",
  "family": [],
  "cited_by": [],
  "pdf_path": null,
  "bibtex_key": "zz900034a12021"
}
