{
  "id": "P-900",
  "kind": "patent",
  "title": "示例文献标题（合成数据，非真实专利）",
  "authors_or_applicants": ["示例申请人"],
  "year": 2026,
  "source_db": "Espacenet",
  "url_or_doc_number": "EXAMPLE-0001",
  "summary_zh": "合成摘要：仅演示字段结构，不描述任何真实技术方案。",
  "relevance": 4,
  "novelty_check": "partial",
  "tags": ["N1@TGT-0002"],
  "logged_at": "2026-01-01T00:00:00+08:00",
  "source_log": "2026-01-01_示例.log.json",
  "family": ["EXAMPLE-0001-A1"],
  "cited_by": [],
  "pdf_path": null,
  "evidence_level": "asserted",
  "evidence_ref": null,
  "evidence_sha256": null,
  "role": "pool",
  "target": "TGT-0002",
  "review_note": "示例：人工复核应写「披露了哪项特征」，而不是「感觉相关」。",
  "reviewed_at": "2026-01-02T00:00:00+08:00",
  "relevance_problem": 4,
  "relevance_means": 4,
  "abstract_raw": null,
  "abstract_source": null,
  "abstract_fetched_at": null
}
