{
  "id": "P-003",
  "kind": "patent",
  "target": "TGT-9007",
  "title": "Air damper delay closing mechanism for freezers",
  "authors_or_applicants": [
    "Ningshi Refrigeration Equipment Factory"
  ],
  "year": 2021,
  "source_db": "Espacenet",
  "url_or_doc_number": "ZZ900073A1",
  "summary_zh": "",
  "relevance": 3,
  "novelty_check": "untouched",
  "role": "pool",
  "evidence_level": "verified",
  "evidence_ref": "../02_search_logs/raw/N4_page-1.csv",
  "evidence_sha256": null,
  "tags": [
    "N4@TGT-9007"
  ],
  "logged_at": "2026-02-03T08:00:00+00:00",
  "source_log": "../02_search_logs/espacenet_2026-02-03_N4_1.log.json",
  "family": [],
  "cited_by": [],
  "pdf_path": null,
  "bibtex_key": "zz900073a12021"
}
