{
  "id": "P-001",
  "kind": "patent",
  "target": "TGT-9001",
  "title": "Low-power broadcast time synchronization method for sensor networks",
  "authors_or_applicants": [
    "Chenguang Microelectronics Research Institute"
  ],
  "year": 2019,
  "source_db": "Espacenet",
  "url_or_doc_number": "ZZ900011A1",
  "summary_zh": "",
  "relevance": 4,
  "novelty_check": "partial",
  "role": "near_prior_art",
  "evidence_level": "verified",
  "evidence_ref": "../02_search_logs/raw/N1_page-1.csv",
  "evidence_sha256": null,
  "tags": [
    "N1@TGT-9001"
  ],
  "logged_at": "2026-02-01T08:00:00+00:00",
  "source_log": "../02_search_logs/espacenet_2026-02-01_N1_1.log.json",
  "family": [],
  "cited_by": [],
  "pdf_path": null,
  "bibtex_key": "zz900011a12019",
  "relevance_problem": 5,
  "relevance_means": 4,
  "review_note": "直接写入而非按队列深度预测修正，手段未完全重叠",
  "feature_mapping": {
    "F1": {
      "status": "partial",
      "ref": "02_search_logs/raw/ZZ900011A1.md",
      "locator": "L10",
      "quote": "汇聚节点在射频开启前的最后一步将本地时刻写入该字段",
      "note": "直接写入而非按队列深度预测修正，手段未完全重叠"
    },
    "F2": {
      "status": "absent"
    },
    "F3": {
      "status": "absent"
    },
    "F4": {
      "status": "absent"
    }
  },
  "assessment": {
    "actor": "ai",
    "by": "benchmark-gold",
    "at": "2026-10-27T02:37:28+08:00",
    "basis": {
      "N1@TGT-9001": {
        "problem": {
          "ref": "02_search_logs/raw/ZZ900011A1.md",
          "locator": "L7",
          "quote": "电池供电节点的时间同步方法",
          "rationale": "同为传感网低功耗时间同步问题"
        },
        "means": {
          "ref": "02_search_logs/raw/ZZ900011A1.md",
          "locator": "L10",
          "quote": "将本地时刻写入该字段",
          "rationale": "信标携带发送时刻，但为直接写入，F1 仅部分披露"
        }
      }
    },
    "materials": {
      "N1@TGT-9001": {
        "problem": "[0001] 本发明涉及无线传感器网络领域，尤其涉及电池供电节点的时间同步方法。",
        "means": "[0004] 信标帧的帧尾设有发送时刻字段，汇聚节点在射频开启前的最后一步将本地时刻写入该字段。"
      }
    },
    "fingerprint": "c395b68d01d75c0b9f90076800a9e7a76d0d3272da3a3cba1f51f1b390e732b8"
  },
  "reviewed_at": "2026-10-27T02:37:28+08:00",
  "review_history": [
    {
      "at": "2026-10-27T02:37:28+08:00",
      "action": "assess:ai",
      "before": {
        "id": "P-001",
        "kind": "patent",
        "url_or_doc_number": "ZZ900011A1",
        "target": "TGT-9001",
        "tags": [
          "N1@TGT-9001"
        ],
        "relevance": 3,
        "relevance_problem": null,
        "relevance_means": null,
        "role": "pool",
        "novelty_check": "untouched",
        "review_note": null,
        "feature_mapping": null,
        "assessment": null,
        "human_confirmation": null,
        "reviewed_at": null
      }
    },
    {
      "at": "2026-10-27T02:37:28+08:00",
      "action": "confirm:human",
      "before": {
        "id": "P-001",
        "kind": "patent",
        "url_or_doc_number": "ZZ900011A1",
        "target": "TGT-9001",
        "tags": [
          "N1@TGT-9001"
        ],
        "relevance": 4,
        "relevance_problem": 5,
        "relevance_means": 4,
        "role": "near_prior_art",
        "novelty_check": "partial",
        "review_note": "直接写入而非按队列深度预测修正，手段未完全重叠",
        "feature_mapping": {
          "F1": {
            "status": "partial",
            "ref": "02_search_logs/raw/ZZ900011A1.md",
            "locator": "L10",
            "quote": "汇聚节点在射频开启前的最后一步将本地时刻写入该字段",
            "note": "直接写入而非按队列深度预测修正，手段未完全重叠"
          },
          "F2": {
            "status": "absent"
          },
          "F3": {
            "status": "absent"
          },
          "F4": {
            "status": "absent"
          }
        },
        "assessment": {
          "actor": "ai",
          "by": "benchmark-gold",
          "at": "2026-10-27T02:37:28+08:00",
          "basis": {
            "N1@TGT-9001": {
              "problem": {
                "ref": "02_search_logs/raw/ZZ900011A1.md",
                "locator": "L7",
                "quote": "电池供电节点的时间同步方法",
                "rationale": "同为传感网低功耗时间同步问题"
              },
              "means": {
                "ref": "02_search_logs/raw/ZZ900011A1.md",
                "locator": "L10",
                "quote": "将本地时刻写入该字段",
                "rationale": "信标携带发送时刻，但为直接写入，F1 仅部分披露"
              }
            }
          },
          "materials": {
            "N1@TGT-9001": {
              "problem": "[0001] 本发明涉及无线传感器网络领域，尤其涉及电池供电节点的时间同步方法。",
              "means": "[0004] 信标帧的帧尾设有发送时刻字段，汇聚节点在射频开启前的最后一步将本地时刻写入该字段。"
            }
          },
          "fingerprint": "c395b68d01d75c0b9f90076800a9e7a76d0d3272da3a3cba1f51f1b390e732b8"
        },
        "human_confirmation": null,
        "reviewed_at": "2026-10-27T02:37:28+08:00"
      }
    }
  ],
  "human_confirmation": {
    "by": "benchmark-operator",
    "at": "2026-10-27T02:37:28+08:00",
    "fingerprint": "c395b68d01d75c0b9f90076800a9e7a76d0d3272da3a3cba1f51f1b390e732b8"
  }
}
