{
  "id": "P-004",
  "kind": "patent",
  "target": "TGT-9002",
  "title": "Battery preheating device for low temperature environment",
  "authors_or_applicants": [
    "Cold Region Vehicle Electrical Research Institute"
  ],
  "year": 2020,
  "source_db": "Espacenet",
  "url_or_doc_number": "ZZ900023A1",
  "summary_zh": "",
  "relevance": 3,
  "novelty_check": "partial",
  "role": "near_prior_art",
  "evidence_level": "verified",
  "evidence_ref": "../02_search_logs/raw/N4_page-1.csv",
  "evidence_sha256": null,
  "tags": [
    "N4@TGT-9002"
  ],
  "logged_at": "2026-02-04T08:00:00+00:00",
  "source_log": "../02_search_logs/espacenet_2026-02-04_N4_1.log.json",
  "family": [],
  "cited_by": [],
  "pdf_path": null,
  "bibtex_key": "zz900023a12020",
  "relevance_problem": 3,
  "relevance_means": 3,
  "review_note": "[0004] 采集的是温度而非端电压；披露了贴附电芯的电阻加热，但为独立 PTC 回路而非均衡电阻余热经导热件传导",
  "feature_mapping": {
    "F1": {
      "status": "absent",
      "note": "[0004] 采集的是温度而非端电压"
    },
    "F2": {
      "status": "absent"
    },
    "F3": {
      "status": "absent"
    },
    "F4": {
      "status": "absent"
    },
    "F5": {
      "status": "partial",
      "ref": "02_search_logs/raw/ZZ900023A1.md",
      "locator": "L13",
      "quote": "加热元件采用正温度系数热敏电阻片，直接贴附于电芯侧面",
      "note": "披露了贴附电芯的电阻加热，但为独立 PTC 回路而非均衡电阻余热经导热件传导"
    }
  },
  "assessment": {
    "actor": "ai",
    "by": "benchmark-gold",
    "at": "2026-10-27T02:37:28+08:00",
    "basis": {
      "N4@TGT-9002": {
        "problem": {
          "ref": "02_search_logs/raw/ZZ900023A1.md",
          "locator": "L8",
          "quote": "在零下环境可充性急剧下降",
          "rationale": "低温可充性问题与 F5 的预热目的相邻"
        },
        "means": {
          "ref": "02_search_logs/raw/ZZ900023A1.md",
          "locator": "L13",
          "quote": "正温度系数热敏电阻片",
          "rationale": "电阻加热手段相似，热源不同"
        }
      }
    },
    "materials": {
      "N4@TGT-9002": {
        "problem": "[0002] 锂离子电芯在零下环境可充性急剧下降，直接大电流充电会析锂并损伤寿命。",
        "means": "[0007] 作为另一种实施方式，加热元件采用正温度系数热敏电阻片，直接贴附于电芯侧面，通电后自限温发热。"
      }
    },
    "fingerprint": "c916945c057a5aceba717e55ae2c370e0303c8115dc8ff3f1743321e350816c4"
  },
  "reviewed_at": "2026-10-27T02:37:28+08:00",
  "review_history": [
    {
      "at": "2026-10-27T02:37:28+08:00",
      "action": "assess:ai",
      "before": {
        "id": "P-004",
        "kind": "patent",
        "url_or_doc_number": "ZZ900023A1",
        "target": "TGT-9002",
        "tags": [
          "N4@TGT-9002"
        ],
        "relevance": 3,
        "relevance_problem": null,
        "relevance_means": null,
        "role": "pool",
        "novelty_check": "untouched",
        "review_note": null,
        "feature_mapping": null,
        "assessment": null,
        "human_confirmation": null,
        "reviewed_at": null
      }
    },
    {
      "at": "2026-10-27T02:37:29+08:00",
      "action": "confirm:human",
      "before": {
        "id": "P-004",
        "kind": "patent",
        "url_or_doc_number": "ZZ900023A1",
        "target": "TGT-9002",
        "tags": [
          "N4@TGT-9002"
        ],
        "relevance": 3,
        "relevance_problem": 3,
        "relevance_means": 3,
        "role": "near_prior_art",
        "novelty_check": "partial",
        "review_note": "[0004] 采集的是温度而非端电压；披露了贴附电芯的电阻加热，但为独立 PTC 回路而非均衡电阻余热经导热件传导",
        "feature_mapping": {
          "F1": {
            "status": "absent",
            "note": "[0004] 采集的是温度而非端电压"
          },
          "F2": {
            "status": "absent"
          },
          "F3": {
            "status": "absent"
          },
          "F4": {
            "status": "absent"
          },
          "F5": {
            "status": "partial",
            "ref": "02_search_logs/raw/ZZ900023A1.md",
            "locator": "L13",
            "quote": "加热元件采用正温度系数热敏电阻片，直接贴附于电芯侧面",
            "note": "披露了贴附电芯的电阻加热，但为独立 PTC 回路而非均衡电阻余热经导热件传导"
          }
        },
        "assessment": {
          "actor": "ai",
          "by": "benchmark-gold",
          "at": "2026-10-27T02:37:28+08:00",
          "basis": {
            "N4@TGT-9002": {
              "problem": {
                "ref": "02_search_logs/raw/ZZ900023A1.md",
                "locator": "L8",
                "quote": "在零下环境可充性急剧下降",
                "rationale": "低温可充性问题与 F5 的预热目的相邻"
              },
              "means": {
                "ref": "02_search_logs/raw/ZZ900023A1.md",
                "locator": "L13",
                "quote": "正温度系数热敏电阻片",
                "rationale": "电阻加热手段相似，热源不同"
              }
            }
          },
          "materials": {
            "N4@TGT-9002": {
              "problem": "[0002] 锂离子电芯在零下环境可充性急剧下降，直接大电流充电会析锂并损伤寿命。",
              "means": "[0007] 作为另一种实施方式，加热元件采用正温度系数热敏电阻片，直接贴附于电芯侧面，通电后自限温发热。"
            }
          },
          "fingerprint": "c916945c057a5aceba717e55ae2c370e0303c8115dc8ff3f1743321e350816c4"
        },
        "human_confirmation": null,
        "reviewed_at": "2026-10-27T02:37:28+08:00"
      }
    }
  ],
  "human_confirmation": {
    "by": "benchmark-operator",
    "at": "2026-10-27T02:37:29+08:00",
    "fingerprint": "c916945c057a5aceba717e55ae2c370e0303c8115dc8ff3f1743321e350816c4"
  }
}
